,text,is_humor,target_1,humor_rating,target_2,humor_controversy,target_3,offense_rating,target_4
335,"My wife walked in on an argument between our son and I. When he ran out of the room crying, I turned to the wife and said, ""I wish I'd used a condom now."" Horrified, she said, ""What? You wish our son had never been born?"" ""No"" I replied. ""I've got his girlfriend pregnant.""",1,1.0,0.18006921,2.22,0,1.0,1.2942818,2.05
336,"Sunflower seeds r anti-aging, rich in Vit E & selenium. Eat a handful a day to stave off wrinkles & improve skin elasticity young health",0,0.0,0.0,0.0,1,0.0,0.0,0.0
337,"I once played chess with an Egyptian King... ...I was distracted for a moment, and when I turned around he was blatantly attempting to cheat. I told him that that wasn't very pharaoh.",1,1.0,0.22715339,2.15,0,0.0,0.20276709,0.0
338,Ok. Who needs a hug? Anyone? I'm giving some away rn for free!,1,0.0,0.11421235,0.0,0,0.0,0.0,0.0
339,Why can't black people get their PhD? They can't get past their masters. rofl,1,1.0,0.1481605,1.85,0,0.0,3.8967066,4.15
340,"People who take frequent long, warm showers and baths tend to be lonelier, according to Yale University scientists.",0,0.0,0.0,0.0,1,0.0,0.0,0.0
341,How do you make a Chinese man no longer Asian? Just spin him around in circles until he's disoriented,1,1.0,0.22097947,2.3,0,0.0,2.5993094,2.05
342,I have received 88 text messages in the last hour....,1,0.0,0.064335,0.0,0,0.0,0.0,0.15
343,"Chadwick Boseman was the first and only person considered for the role of T'Challa in ""Black Panther."" When Chadwick's name came up in a creative story meeting, Marvel immediately settled on him.",0,0.0,0.0015894771,0.0,1,0.0,0.0,0.15
344,Wanna go somewhere that has FREE WINE?' Me: Heck yes! 'Done. Pick you up Sunday at 8am!' Me: What?! -how I got tricked into going to church,1,1.0,0.3082672,2.53,0,1.0,0.0,0.25
345,"In every gay relationship comes drama, insecurity, infidelity, uncertainty and heartbreaks. The ability to overcome these hurdles is the only secret to a successful, long-lasting relationship.",0,0.0,0.035050094,0.0,1,0.0,0.0,1.1
346,Thanks for being a part of the TREND y'all! LOV Eis,0,0.0,0.0,0.0,1,0.0,0.0,0.0
347,Funny that when a girl sleeps with a lot of guys she's considered a slut ... but when I do it I'm gay.,1,1.0,0.2461707,3.0,0,1.0,3.0896552,1.55
348,"""Don't overthink, just let it go."" - Live While We're Young.",0,0.0,0.0,0.0,1,0.0,0.0,0.0
349,"Being in love makes you a less productive person, according to researchers from the University of Maryland.",0,0.0,0.0,0.0,1,0.0,0.0,0.0
350,"In Norway, it takes three years of higher education to become a police officer. Graduates are awarded a Bachelor's degree in Police Studies.",0,0.0,0.013388455,0.0,1,0.0,0.0,0.0
351,"""I let you push me past the breaking point."" - Katy Perry.",0,0.0,0.0,0.0,1,0.0,0.0,0.0
352,My wife left me because she said I made a meal out of everything. I intend to make her eat those words.,1,1.0,0.2694454,2.65,0,1.0,0.0,0.15
353,[fridge shopping] Salesmen: What type of fridge are you looking for? Me: Do you have something in stainless steel that does a good job hiding rotting vegetables?,1,1.0,0.1521501,2.1,0,0.0,0.0,0.0
354,What's the difference between MLK day and St Patrick's day? Nobody minds being Irish for one day!!!!,1,1.0,0.2084124,1.58,0,1.0,1.3830214,2.5
355,Why didn't the mobsters car parts fit? ...they all fell off a truck.,1,1.0,0.22255109,1.45,0,0.0,1.0312058,0.35
356,vitamin B6 help brain function & converts protein to energy. Vit B6 foods potato bananas beans red meat fish eggs spinach & fortified cereal,0,0.0,0.0,0.0,1,0.0,0.0,0.0
357,Luckily I never started vaping because there were many conclusive studies stating I would never look cool doing it.,1,1.0,0.23299174,1.88,0,0.0,0.0,0.05
358,Stop tolerating unacceptable behavior. No girl wants to date a doormat.,0,0.0,0.06985602,0.0,1,0.0,0.0,0.2
359,Did you hear about the guy who dipped his balls in glitter? Pretty nuts,1,1.0,0.19533941,3.0,0,1.0,0.8213216,0.6
360,I drink water throughout the day to stay hydrated and also just in case someone says something shocking so I can spit it out.,1,1.0,0.1783449,2.35,0,1.0,0.0,0.0
361,What's green and not heavy? Light green h,1,1.0,0.29024145,1.95,1,1.0,0.0,0.0
362,Why are there no transvestites in space? Because there is zero drag.,1,1.0,0.20873192,2.47,0,0.0,2.4532475,1.65
363,Speak the truth even if it be against yourself,0,0.0,0.0,0.0,1,0.0,0.0,0.0
364,"How do you know a chinese thief has broken into your house? All of your rice is gone, your computer is fixed, and the mother fucker is still trying to back out of the driveway.",1,1.0,0.21273193,2.45,0,1.0,3.4933455,3.7
365,A Roman Emperor orders his guards to arrest his wife. He orders them to Ceas'er.,1,1.0,0.23658009,2.7,0,1.0,0.35030568,0.0
366,Enjoy your weekend! We are going to tweet some thought provoking quotes from the twittersphere...,0,0.0,0.0,0.0,1,0.0,0.0,0.0
367,Mix buttermilk and salt into paste. they r effective in eliminating large pores. repeat few times a week. pores skin,0,0.0,0.116367094,0.0,1,0.0,0.0,0.0
368,"My girlfriend just said, ""Your obsession with cats is out of control, so I've packed your bags."" I think she's kicking meeeowt.",1,1.0,0.19722328,3.2,0,1.0,0.13224952,0.0
369,How many Americans does it take to screw a lightbulb? None. Their President outsources the job to India.,1,1.0,0.20716271,2.85,0,1.0,2.016161,1.0
370,I threw an Asian man down a flight of stairs. It was Wong on so many levels.,1,1.0,0.22174884,2.35,0,1.0,2.7984579,3.2
371,"As a Tennessean, it makes me sick that there are monuments standing in our state that celebrate racist historical figures who did evil things. Edward Carmack and Nathan Bedford Forrest were DESPICABLE figures in our state history and should be treated as such.",0,0.0,0.119139194,0.0,1,0.0,0.0,0.4
372,Did you hear about the guy that was half Black and half Japanese ... ... every December 7th he would attack Pearl Bailey.,1,1.0,0.21253845,1.45,0,0.0,2.6821535,3.15
373,What is the most effective way to quit being vegan? Cold turkey.,1,1.0,0.29260856,2.7,0,0.0,1.1704808,0.2
374,Imagine how lame drag and Drag Race would be without the contributions of trans performers.,1,0.0,0.29585892,0.0,1,0.0,0.70813626,0.4
375,Today's National Bagel Day! What's your favorite type of bagel? ¥¯,0,0.0,0.0,0.0,1,0.0,0.0,0.0
376,What do you call black men working while white men watch? The NBA,1,1.0,0.30929765,2.45,0,1.0,3.3013537,2.65
377,All she wants is attention. How hard is it to give it to her?,0,0.0,0.109828845,0.0,1,0.0,0.0,0.2
378,I thought I had hypochondria... ...turned out it was all in my head.,1,1.0,0.19969189,2.0,0,0.0,0.07339129,0.45
379,How do you blindfold an Asian person? You put floss over his eyes.,1,1.0,0.21979278,2.0,0,1.0,2.6352155,3.75
380,"""This report is a call for action to address a large public health problem [suicide] which has been shrouded in taboo"" --Dr. Margaret Chan",0,0.0,0.0,0.0,1,0.0,0.0,0.0
381,If she's not ruining your life.....She's just not that into you.,0,1.0,0.12896363,2.2,1,1.0,0.0,1.0
382,I thought my dad spent all his savings on an expensive wig. But one look and I realised it was a small price toupee.,1,1.0,0.2302157,2.58,0,1.0,0.1739736,0.0
383,Wife: Do that sexy thing I like Me: *pays for dinner with a coupon and saves money*,1,1.0,0.17134395,2.65,0,1.0,0.0,0.05
384,"My friend went bald years ago, but still carries his old comb with him. He just can't part with it.",1,1.0,0.19663222,2.56,0,1.0,0.0,0.0
385,"professor: osmium is the densest material on earth, 22 grams in 1 cubic centimeter me: so you're saying- professor: [nodding] thicc as fuck",1,1.0,0.14323288,1.56,0,1.0,0.0,0.35
386,ME AFTER 2 GLASSES OF WINE: This beautiful life is meant to be enjoyed! Let us feast and make merry! ME AFTER 4 GLASSES OF WINE: I have 938 worst enemies and I will now name them all.,1,1.0,0.28623694,1.94,0,1.0,0.0,0.0
387,Regret does nothing but slow you down. Learn and move forward.,0,0.0,0.0,0.0,1,0.0,0.0,0.0
388,"""City-dwelling mothers who developed postpartum were members of immigrant populations, which typically have weaker social support networks.""",0,0.0,0.0,0.0,1,0.0,0.0,0.15
389,Everyone retweet this video and I’ll send you a love letter DM.,0,0.0,0.0,0.0,1,0.0,0.0,0.0
390,What's the difference between a stripper and a hooker? Usually about $40,1,1.0,0.27961293,2.45,0,1.0,1.7331303,1.95
391,"At the Olympics I saw a man carrying a long sick and I asked, ""Are you a pole vaulter?"" He said ""No. I am German but how did you know my name was Walter?""",1,1.0,0.19764696,2.4,0,1.0,0.8232889,0.05
392,"My mom used to feed my brother and I by saying 'here comes the train', and we always used to eat it right away...otherwise she wouldn't untie us from the tracks",1,1.0,0.2882171,2.72,0,1.0,0.0,0.0
393,"It's pretty hypocritical that the word 'repetitive' has three e's, two t's, and two i's in it.",1,1.0,0.2702225,2.06,0,1.0,0.0,0.0
394,"Don't ever break a women's heart, they've only got one. Break their fucking bones they've got over 200 of those.",1,1.0,0.31950393,1.63,0,0.0,3.5177515,3.6
395,COP: You carrying any dangerous weapons? *I glance down at my hands which are naturally resting in the karate chop position* ME: [lying] No.,1,1.0,0.17647338,2.16,0,1.0,0.0,0.0
396,My wife has this weird OCD where she arranges the dinner plates by the year they were bought. It's an extremely rare dish order.,1,1.0,0.21432269,2.26,0,0.0,0.0,0.15
397,"I got chatting to a black chick in the pub last night and she asked if I fancied taking her home. ""Fuck off"" I told her "" I'm not driving to Africa at this time of night"".",1,1.0,0.21077618,1.65,0,1.0,3.3186646,3.8
398,I like to say 'toodles' when I leave work so my coworkers know the workplace alpha male has just left.,1,1.0,0.15789014,2.68,0,1.0,0.0,0.4
399,"For the past few days, I wake up to see someone has dumped a bunch of LEGO blocks on my front porch. I don't know what to make of it.",1,1.0,0.11213705,2.71,0,1.0,0.0,0.0
