,id,text,is_humor,humor_rating,humor_controversy,offense_rating
649,9650,"Anxiety: This airplane might crash and then you'll die! Me: Oh no! Depression: I'm okay with that. Anxiety: ...but then again, you could survive, end up paralyzed, and life would be even harder than it already is! Me and depression (now holding each other): On no!",1,2.3669267,0,0.0
650,9651,"Eyes blinking in the dark. Wide awake. Asking self, was there coffee in that coffee ice cream?? 👀",1,2.3005884,0,0.0
651,9652,[remembering women like mysterious men] *texts my hairdresser the squid emoji*,1,2.4408488,0,0.0
652,9653,"nothing like waking up at 3am to discover you're a mutant with lava in your throat, professor x will be so prou..what's that now...i'm being told from multiple sources it's just heartburn",1,2.425286,1,0.071866155
653,9654,Hope you enjoyed your church service today as much as I did mine. What a blessing my church family is! Gods Family Committed To Each Other,0,0.6610204,0,0.0
654,9655,Stayed tuned for a all new Shaving People Punting Things later today! SPN Family Supernatural jimi on s,0,0.39468232,0,0.0
655,9656,"So often when posting about vaccines I get the response ""my child is vaccine injured"" with no other explanation. I'm genuinely curious...to parents who believe their child has been harmed from a vaccine, what EXACTLY is the injury you speak of.",0,1.3017697,0,0.06779685
656,9657,Why did the computer crash? Because it had a bad driver! corny,1,2.748248,1,0.0
657,9658,The easiest way to bridge a language barrier is by yelling at the other person. People find it easier to understand a foreign language when it is louder.,1,2.1299057,0,0.15967494
658,9659,"Traveled across the country, heard a lot of powerful stories, and found incredible talent. Next stop: Hollywood! American Idol",0,0.32518205,0,0.03742046
659,9660,"I still think of that time when my 9yo was 5 and yelled really loud, ""it looks like that elephant has a big penis on his face!"" at the zoo.",1,2.5620854,1,0.4769526
660,9661,I shared my whole body with my 3yo and she won't share her fruit snack with me. Can you believe that?,1,3.0925639,0,0.0
661,9662,It's always nice to win an arm wrestle against guys who are younger than you. Today it was a 3 year old.,1,2.7591114,1,0.0
662,9663,4 minutes in and I'm already holding back tears.... American Idol,0,1.0914751,0,0.0
663,9664,Why doesn't democracy work in china? Because no one wants to hold an erection.,1,2.327107,1,2.8090477
664,9665,watching a nature documentary with the family and loudly saying 'that's how your mother and I met' every 5 minutes,1,2.7148113,0,0.0
665,9666,The perfect cure for loneliness at home is Twitter. All it takes is 5 mins of seeing everyone arguing to pretty much remedy any desire to be around people.,1,2.339777,0,0.0
666,9667,Are you the reason why someone is not seeking the help they need for their mental or emotional challenges? Stomp Stigma and encourage them!,0,0.5736762,0,0.036343977
667,9668,"If a man talks dirty to a woman, that's sexual harassment. If a woman talks dirty to a man, that'll be $6.50 a minute.",1,2.3510325,1,2.565734
668,9669,Dear Rita Baga that was the best lip synch of the season.,1,2.1206393,0,0.095495746
669,9670,"I'm sad that I didn't know how amazing of a man Chadwick Bozeman was until he died. He was kind, generous, and heroic.",0,1.1394097,0,0.0
670,9671,"[the streetlights burst. the stars blink out. hooded figures surround us] me: *to wife* omg is this a gender reveal? cultist: hail satan. the union of these mortals shall bare his child, The Antichrist me: will it be a boy or a girl? cultist: why are you so fixated on this",1,2.3723526,1,0.33874252
671,9672,Therapist: And what do we do when we feel upset or angry? Me: We eat snickers bars until we feel better? Therapist: No. Me: (already shoving a snickers bar in my mouth) I'm going to need a minute to calm down,1,1.860921,0,0.0
672,9673,trainer at gym: do you exercise outside of here? me remembering it was windy in the parking lot: some resistance training,1,2.889514,1,0.0
673,9674,Don't miss CDC's Tips Campaign's Rico on The Doctors -- right now!,0,0.49940982,0,0.0
674,9675,"Don't compare yourself to other people, compare yourself to pigeons... they're idiots and it'll make you feel better.",0,1.4958165,0,0.055009216
675,9676,"If I won the lottery, I'd buy the suits from the movies Batman, Ironman, Superman, etc and it's all I'd wear. No more regular clothes.",1,2.2597737,0,0.0
676,9677,"I work in a popular hotel... I see people come in to stay from all over the world, yet for some reason I've never seen a Native American here. I guess they just don't like to make reservations.",1,1.7997226,0,2.9802108
677,9678,Everyone you come across has something that they can teach you,0,0.8231836,0,0.0
678,9679,"I was in the bathroom and I texted my husband to bring me toilet paper and he responded with send nudes. The audacity, this marriage isn't an onlyfans account.",1,2.8289375,1,1.0909065
679,9680,“we haven’t talked since he puked on the floor and wiped it up with my cat” - rude - personal - only happened once “our perspectives differ on key issues” - intellectual - acknowledges both sides of a complex debate - celebrates the marketplace of ideas,0,1.1226828,0,0.0
680,9681,What do you call a homosexual Hispanic peeping tom? Peeko-da-guyo.,1,1.7367499,0,3.4669776
681,9682,"Interviewer: ""Where do you see yourself in 5 years?"" Me: ""I'd say my biggest weakness is listening""",1,2.5261657,1,0.0
682,9683,"ten minutes into the our planet documentary on netflix and I don't know if im going for the birds, the fish or the dolphins",1,2.7182841,1,0.0
683,9684,Congratulations to my long time friend Sam on 15 years of helping those who have battled cancer get back on their feet. Amazing person with an amazing heart. All love samfund15,0,0.44781637,0,0.0
684,9685,If you eat a cookie and you don't finish your milk you need to get another cookie. If you don't have enough milk for the second cookie you get more milk. If you don't finish the milk you get another cookie... that's the cookie cycle.,1,2.7076356,0,0.0
685,9686,Help! Can anyone tell me where I can watch the Women’s World Cup??? I can only find 18 channels of golf...,1,1.5111436,0,1.0357763
686,9687,It's a bit hypocritical that there's no way to shorten the word abbreviation,1,2.791116,1,0.0
687,9688,I said hello to a feminist My court date starts tomorrow.,1,2.3840752,1,1.3892567
688,9689,Damn girl are you a smoke detector? Because you're super annoying and won't shut up,1,2.54299,1,0.48595762
689,9690,Today in art class my 5yo recreated the poop emoji with play-doh and my 3yo made a cut out of her butt. I would say homeschooling is going great.,1,2.7367785,1,0.1391497
690,9691,This might be a triggering time for some people. Take care of yourself and family. Unplug. Sign off. Keep it calm. Stay well. blk mental health,0,0.5607664,0,0.0
691,9692,"So a priest, a pedophile and rapist walk into a bar ...he orders a drink",1,2.089279,1,2.7467496
692,9693,"Please consider supporting the PTWA on Giving Tuesday, 11/29/16 so we can continue our mission of helping needy children and their families.",0,0.44478044,0,0.0
693,9694,What does a homeless man gets for Christmas? A cold.,1,2.6602278,0,0.92116684
694,9695,"At this point, no one thought it was an accident anymore and AIM was blowing up. Everyone's AIM away message was about shock and fear. We all kept looking at the Prudential Building to see if it would be next. We skipped class and just stared at the TV in disbelief.",0,0.94479203,0,0.180472
695,9696,Why are a German vegetarians pessimists? Because they always fear the wurst.,1,2.3742433,1,0.67472947
696,9697,"""For unto you is born this day in the city of David a Savior, who is Christ The Lord."" Luke 2:11 Thank you, Father! Merry Christmas Everyone",0,0.6388075,0,0.0
697,9698,"Will you date me? breathe if yes, swim across the atlantic ocean while reciting the bible in japanese if no",1,2.0436916,1,0.5426725
698,9699,SPEAK UP! Feeling sidelined? Speak up Suffering abuse? Speak up Need healthcare? Speak up Need a friend? Speak up Feel suicidal? Speak up. Hard to feed yourself? Speak up Don't DIE in your SILENCE. You never know who's ready to help.,0,0.53445756,0,0.033416003
699,9700,"The vape pen maybe mightier than the vape sword, but neither of them will get you a girlfriend.",1,2.4835107,0,0.25937676
700,9701,"We celebrate our independence, I say triumphantly as I ask my wife's permission to have a beer with lunch.",1,2.653402,0,0.0
701,9702,"If u have received death threats or suffered abuse n hatred for being gay, you have the right to seek asylum in a pro-LGBTQ country. Remember, Universal Declaration of Human Rights states that ""Everyone has the right to seek and enjoy in other countries asylum from persecution.""",0,0.25494388,0,0.10947756
702,9703,What do you call a geologist who can't hear? Stone deaf...,1,2.2784634,1,0.3557825
703,9704,"*Goes on internet. People arguing, everything sucks, we're all doomed *Goes outside. Birds are chirping, sky is blue, sun is shining. 'Meh' *Goes back inside, logs onto internet.",1,2.498073,0,0.0
704,9705,Maybe your cat wouldn't push stuff off your shelf and countertop if your interior decorating wasn't so dreadful,1,2.2172973,0,0.1743583
705,9706,"Count at least one positive thing each day, even if some days you have to look a little harder",0,0.61991477,0,0.0
706,9707,Today we salute the heroes who fought and sacrificed for our country. Thank you to the brave men and women who served in the U.S. military for our liberty! Memorial Day,0,0.37235907,0,0.0
707,9708,"I had so much fun at Green Horizons, I forgot to call momWhen I got home she was mad, but I was glad [because of how much Green Horizons provided me].' Ofri, Green Horizons Student Powered By JNF Love Grows In Israel Green Horizons",0,0.72377765,0,0.0
708,9709,"*My 2 year old hurts himself and comes to me crying *I pick him up and hug him Me: I know it hurts.. don't worry, it will go away. Physical pain always goes away. Emotional pain on the other hand will scar you for life and haunt you well into adulthood. Now go play and have fun",1,2.5148587,0,0.0
709,9710,"When we’re uncertain, books bring us comfort. When we’re scared, books bring us hope. When we’re isolated, Books Connect Us.",0,0.52425754,0,0.0
710,9711,India is a very peaceful country because nobody has any beef over there.,1,2.031745,0,0.35556918
711,9712,Believe me when I tell you: A mistake repeated more than once is a decision.,0,1.1994781,0,0.0
712,9713,they put you to sleep right away in the operating room so they can take off their masks and start eating sunflower seeds,1,2.8175857,1,0.8512646
713,9714,Shayy Winn's journey just started but her fighting already inspired so many. American Idol,0,0.57315475,0,0.022042647
714,9715,me: it's a service dog teenager working the waterslide: still has to wait up here,1,1.7853254,1,0.6812315
715,9716,Big thanks to our concerned fans. Our family is ok. Lots of power lines/trees down with big damage to homes/businesses. Pray 4 Those Affected,0,0.45975372,0,0.0
716,9717,"Guys, act silly with her&lt;3 boyfriend tips",0,1.2949772,0,0.14020006
717,9718,"Why is my Chinese girlfriend so bitchy? Well it's true, you are what you eat.",1,2.1367795,0,3.3123426
718,9719,Being married won't heal you and being single won't kill you. Have patience and choose wisely.,0,0.8174785,0,0.0
719,9720,What do you call a Mexican baptism? A bean dip.,1,2.5219848,0,2.0563123
720,9721,Yesterday I farted in a Apple Store and everyone got mad at me. It's not my fault they don't have Windows,1,2.4110215,1,0.3456822
721,9722,"How fun watching Duck Commander: Before the Dynasty! I forgot how good these were. Hope you're watching, too! Good Ole Days",0,0.5530419,0,0.0
722,9723,Why did the alcoholic comedian quit performing? He couldn't handle the boos.,1,2.7215571,1,0.7548408
723,9724,Most people who say they would spend the night in a haunted mansion for a million dollars scream and run away when a moth flys towards them,1,2.2683806,0,0.25157836
724,9725,stop telling me to get a cast iron skillet. i do not have the mental or emotional capacity for this. i don’t even know how to do taxes.,1,2.131427,0,0.0
725,9726,"Womansplaining is when a woman explains something that is obvious, but the difference is that it's usually necessary... ie: when I can't find ketchup in the fridge and my wife womansplains how it's right in front of my face.",1,2.407784,0,1.6686138
726,9727,"me: i try to get in at least 20,000 each day her: steps? me: leagues under the sea",1,2.6005855,1,0.0
727,9728,"Dude, you could put the tiniest bit of effort into pretending you're going to consult the actually existing peer-reviewed publications based on extensive fieldwork in which she analyzes precisely the thing you're curious about because you saw a clip on FB",1,2.116726,0,0.20443374
728,9729,What's the worse thing to do to a blind person? Leave a plunger in the toilet,1,2.1501129,1,2.1825056
729,9730,"As a father, I hope my kids can grow up and be in a better place than we are now. It starts with us, as parents, we are the people our children look up to.",0,0.7224164,0,0.0
730,9731,Phil spoke a powerful message this morning of being saved by God's power. Death did not hold Him and it won't hold us! Romans 6 Happy Easter!,0,0.4249782,0,0.0
731,9732,Robots will someday ruin the world? They already have. They're the reason we all have to take annoying captcha quizzes every time we want to use the internet.,1,2.4901528,1,0.66200024
732,9733,ME: let’s clean up the living room before mom gets home 4yo: but how will she know how much fun we had? ME: hmm good point!…,1,2.7152216,1,0.0
733,9734,"Me: Look team, our productivity is way down. I’m sorry to be harsh but I cannot call what you’ve done lately “work.” That’s three silverfish I’ve seen this week. Or one silverfish three times but either way- you gotta step it up. All The Spiders In My House: 😔",1,2.3650253,0,0.1547012
734,9735,"My 3yo asked if she could eat gummy bears for breakfast, I said no. Then she said, ""what if I eat them like cereal with milk."" I mean I knew she was smart, but this is genius. Adds milk, BAM breakfast!",1,2.9764771,0,0.0
735,9736,Why does Dr. Pepper come in bottles? Because his wife is dead.,1,2.5121622,0,0.8020663
736,9737,Be that girl you always wanted to be!,0,0.3878587,0,0.11610817
737,9738,"Surprise everyone at work by being pleasant on a Monday. They'll be so unnerved that something is wrong, they'll leave you alone for the entire day.",1,2.0739427,0,0.0
738,9739,Let it be known that I was totally against this. Totally! Highlanf Games Are For Pros Dont Hurt Yourself Way Too Competitive,0,1.1667731,0,0.0
739,9740,Sorry I thought we were on the kiss cam when I saw us standing in line on the security monitor at 7-11.,1,2.7674801,1,0.083363384
740,9741,"Anyway, I welcome recommendations for smart pieces on how rules about ""professional"" dress in workplace / school contexts are gendered, raced, and classed and how even facially neutral rules lead to discriminatory outcomes.",0,0.7741548,0,0.0660582
741,9742,"No putting together toys tonight! No bikes, doll houses or electronic anything! Pros of having 19, 17 and 11 year olds! Merry Christmas To Me",1,2.2268717,0,0.0
742,9743,Me: *letting my kid win* My 4yo: Mommy you’re really bad at this,1,2.8058476,0,0.0
743,9744,"Guys, make sure you call her beautiful, not hot or pretty. Beautiful means so much more. boyfriend tips",0,0.8939779,0,0.0
744,9745,"Hinduism discourages vyasana, or unhealthy dependence on substances such as tobacco. Join this interfaith effort this week! no menthol sunday",0,0.53121424,0,0.0
745,9746,Deliveries for tonight are complete! Stay tuned for more updates!,0,1.0192331,0,0.0
746,9747,"I miss my dog so much since he died, I just paid a homeless guy to come over and take a shit on my kitchen floor and then eat it.",1,2.7824862,0,1.2744162
747,9748,Have people gotten to the point where they are worried where their food will come from? If you have a family to feed comment below I'll help as many people as possible. If you're reading this and can afford to help I recommend you do the same.,0,0.6471664,0,0.0
748,9749,Why Cant Girls Count To 70? .....Because 69 is a mouthful,1,1.7850889,1,2.5518422
749,9750,Why did the chicken cross the basketball court? He heard the ref was blowing fouls,1,2.3555214,1,0.5031562
750,9751,"Even after you got the girl, keep working for her like you haven't gotten her yet.",0,0.53994083,0,0.0
751,9752,"If you're American when you go into the toilet, and Asian when you come out, what are you on the toilet? European!",1,2.244336,1,1.8287684
752,9753,I think that bisexual girls should just call themselves more-or-lesbians.,0,1.1136947,0,1.0502622
753,9754,"Days later, even weeks later, when we saw planes take off from Logan and fly past the Prudential building we held our breath. After the initial deaths from the impact, it was the smoke and toxins that killed the EMS workers. The pain lasted a long time.",0,1.299286,0,0.10939654
754,9755,"I love how confident my 3yo is with my love. I tell her I love her and she says, I know.",1,2.1581705,0,0.0
755,9756,Being told that because I'm a Reform Jew that I'm not actually a Jew and that my smicha as a reform rabbi isn't recognized is a pretty shitty thing to hear from someone.,1,2.346178,0,1.0575274
756,9757,We could never thank our Veterans and active military enough for the sacrifices they have made and continue to make! freedom is not free º,0,0.54312956,0,0.0059235226
757,9758,Inappropriate headline for a Mexican murder story Another Juan Bites The Dust,1,2.141344,1,1.5596505
758,9759,"If I could go back to high school with all that I know now, people would be like ""why are you here old man? Are you a teacher or something?""",1,2.255333,0,0.0
759,9760,"Focus on your rainbows, not your thunderstorms",0,0.6024431,0,0.0
760,9761,"99% Indians work on the Principle of Rockets. It doesn't mean we aim for the sky. It means, we don't start work unless our tail is on fire",1,2.009685,0,3.1544304
761,9762,Bringing women of all backgrounds and experiences 2gether in 1 place 4 fun laughter and honesty while gaining lifeships and learning life brands,0,0.4407836,0,0.0
762,9763,Question of the day: What is your natural talent or gift?,0,1.1666019,0,0.0
763,9764,"My 3yo is so lazy. She said she doesn't like underwear because she has to walk to the bathroom. If she wears a diaper she can pee wherever she wants. Honestly, she's selling me on the diaper thing.",1,3.0717106,1,0.3001285
764,9765,Are the majority of truly successful women married? I 've spoken to a few women and they all seem to agree if they were still married they 're career would be completely different. Do women play themselves down in marriage to lift up their partners? marriage food for thought,0,1.1190995,0,0.14189307
765,9766,"I was having sex with a female amputee in the dark I trying to figure out why my ass hurt, but she had me stumped.",1,2.1450834,1,2.4160347
766,9767,The sunnah is like Ark of Noah. Whoever embarks upon it reaches salvation and whoever refuses is drowned.' - Imaam Malik,0,1.0797793,0,0.0
767,9768,You are loved. Just because you haven't found Mr. Right doesn't mean you aren't attractive. You are handsome and love will find you soon. Happy New Week!,0,0.29562628,0,0.0
768,9769,"Black gay men living with HIV are more likely to suffer depression and suicidal thoughts. It gets even worse when such men live in toxic, homophobic societies. Remember, you always have a home with us. World Suicide Prevention Day",0,0.44992027,0,0.321127
769,9770,Setting an alarm on an iPhone is exciting because it feels like you're spinning the wheel on the price is right,1,2.8647997,1,0.0
770,9771,*has no girlfriend or kids* *gives out dating and parenting advice*,1,1.6793445,0,0.37948194
771,9772,What did the mommy broom say to the baby broom? Time to go to sweep.,1,2.2705252,0,0.0
772,9773,My girlfriend accused me of being a transvestite... ...So I packed her things and left.,1,2.5848827,1,1.3178643
773,9774,I see you.. Still pressing on inspite of your health issues. I see you.... Living your dreams eventhough friends and family rejected you. I see you... Bravely embracing the storms of life with a smile.. I see y'all..keep fighting!,0,0.4221569,0,0.0
774,9775,"You'll always be your own worst critic. But if you can move past it, you can really start to succeed and have fun doing it!",0,0.53678524,0,0.0
775,9776,Putting a woman on a $10 makes sense . . . . . . no one really wants a 1 or a 5.,1,2.2158647,1,2.4593325
776,9777,"If you're a Black Trans person in Philly or NJ, please fill out the form as well! We are working on extending services!",1,0.5524504,0,0.9846941
777,9778,"Summer tip: On a hot day, beer is not a good way to hydrate... it's a great way to hydrate.",1,2.6290116,0,0.0
778,9779,"It's 10pm and I'm still awake which is wild, so I decided to take a shot of milk and eat some peanut butter cookies cuz YOLO. God I'm getting old.",1,2.964397,0,0.0
779,9780,"Tonight is a night of a lot of risks in arrangements, new sounds, and song choices. Hey, let's count how many times the word risk is said during tonight's episode! American Idol Hollywood Week Solos",0,0.7887162,0,0.0
780,9781,Looking for some new music suggestions today! What are you all listening to?,0,0.17174283,0,0.0
781,9782,This is the longest I've been in a drunk time,1,2.5033216,0,0.1356548
782,9783,It's called TikTok just to remind you of how you're wasting your life,1,2.6941059,1,0.0
783,9784,"Girls, your allowed to kiss him first... I promise",0,1.3120129,0,0.005653953
784,9785,"Thanks for watching tonite. Remember, Jesus was the ultimate gift. We'll never measure up to that, but we can try our best. Love Thy Neighbor",0,0.6565116,0,0.0
785,9786,"When I was a kid I couldn't wait to become an adult. Now that I'm an adult I'm just like, this really sucks.",1,2.8726397,0,0.0
786,9787,Recent studies show that 1 out of 3 Americans weigh as much as the other 2 put together.,1,2.3315866,0,0.67640865
787,9788,You know you have some loud kids when the default setting on your tv has subtitles.,1,2.9700408,0,0.24272998
788,9789,Why did I quit my job in Mexico? It didn't peso well.,1,2.9095047,0,0.32054335
789,9790,I don't understand why my kids are so funny. I haven't given them enough childhood trauma for them to be this funny.,1,3.0041876,0,0.8640128
790,9791,"""shake what ya momma gave ya!"" *starts shaking low self-esteem*",1,1.9496698,0,0.0
791,9792,"Want to hear from you all. Going to answer some fan questions on my website, comment below and will release an article next week with my answers!! Use Ask Stray so I can see it.",0,0.6474385,0,0.0
792,9793,"Since we seem to be terrified of homosexuals, it would seem that the key to conquering America would be to attack us with an all-Gay army.",1,1.3364049,0,1.9923717
793,9794,"If you're easily offended, the FDA just approved a new drug. Ask your doctor if Growacet is right for you. ROFL",1,2.1140177,1,0.3862619
794,9795,"I always ask if they accept bitcoin whenever I buy something. I don't have any, but it makes me look cool.",1,2.578086,0,0.0
795,9796,"My friends and I have a secret handshake that my wife says is lame. She's just jealous of how cool we look, especially at the end when we do jazz hands.",1,3.1274364,1,0.0
796,9797,"In the wake of three of our Black Trans Sisters being taken from us in just a few days, we want to call in peace, healing, and love to all Black Trans women everywhere. We also want to call on community and allies to do their part to protect Black Trans Women.",0,0.18578292,0,0.20106344
797,9798,Comparison is the thief of joy. Never compare never compete.,0,0.45879927,0,0.0
798,9799,"It turns out my high school Chemistry teacher was right, alcohol IS a solution.",1,2.5317078,1,0.0058984943
799,9800,People remember you for what you 've done. Not what you wish you 'd done. your girlfriend next door,0,0.90354073,0,0.0
800,9801,Jajajajajajaja is either a Mexican laughing or a German having sex.,1,2.306745,0,1.2563261
801,9802,This keto diet sucks. I haven't lost a single pound. Biggest waste of 5 mins ever.,1,2.36373,0,0.0025556085
802,9803,"Sat in Phil's living room today while he and Si watched the news. ""Spouses fight b/c of low blood sugar?! Pass out the candy!"" Problem Solved",1,2.4831133,1,0.21527049
803,9804,trying to calm people down by yelling 'but that's just my opinion' after saying it doesn't matter if you peel carrots before you use them,1,2.4460173,0,0.0
804,9805,Is 2020 flying by or not going fast enough?,0,1.0226065,0,0.0
805,9806,Cows can't walk down stairs' sounds like a lie a lazy cow made up so he could stay upstairs watching netflix in bed.,1,2.6233273,1,0.27351934
806,9807,The only difference between comedians and the rest of joke Twitter is that comedians get to see people be disappointed by their jokes in person.,0,1.8511865,0,0.0
807,9808,"You can't change other people, but you can change how you are around them, and a lot of times, that's more than enough.",0,0.28287303,0,0.0
808,9809,"People always tell you to listen to your gut, but all mine tells me is feed me cinnamon buns",1,2.884281,1,0.0
809,9810,@BurgerKing I love the way all employees working the drive thru speak English as a 14th language. I just got a frog and an avocado.,1,2.4518032,0,0.0
810,9811,Me: oh shit 3yo: oh shit Me: I forget kids are like sponges 3yo: like a sponge,1,2.5082455,1,0.0
811,9812,Keep the romance alive in your marriage by randomly rubbing your foot against your husband's foot when you're in bed.,0,1.9641467,0,0.0
812,9813,My friend got a tattoo of his wife's name so I guess he loves her as much as he loves barbed wire.,1,2.6077218,1,0.464493
