,id,text,is_humor,humor_rating,humor_controversy,offense_rating
0,9001,Finding out your ex got fat is like finding 20 bucks in your pocket. Not life changing but definitely puts a smile on your  face.,1,2.3887815,1,1.7785606
1,9002,"For Brockmann, stereotypes imperil national security if real threats go unnoticed while racialized Muslims are stigmatized as violent and fanatical. Moreover, she claims, positive as well as negative stereotypes prevent intimacy and love from flourishing.",0,0.35028496,0,0.054459456
2,9003,"A girl runs up to her mother with a pile of crap in her hand ""Look what I almost stepped in!""",1,2.576903,0,0.0
3,9004,gotta wonder if baseball still would've been called america's pastime if candy crush was around,1,2.2503796,0,0.24105708
4,9005,"When you're dreading getting in the shower cuz you're lazy, but then you get in and you're like, this is my home now.",1,2.3181043,0,0.0
5,9006,Parenthood feels like you're on a magical unicorn that's on fire and eats your food.,1,2.906477,0,0.0
6,9007,"It's Friday night and I'm out of control! Getting a bit wild tonight cuz I'm about to put on my good pajamas, and eat some Froot Loops on the couch with a fluffy blanket.",1,2.3877256,0,0.0
7,9008,me: I didn't know this was a hibachi restaurant waiter throwing shrimp at me: it's not I just don't like your face,1,1.9088776,1,0.17639974
8,9009,Maybe we need to turn the United States off and then back on again.,0,1.3948013,0,0.20148765
9,9010,I asked my North Korean friend how it was there.. .. he said he couldn't complain.,1,2.4603896,1,2.378734
10,9011,me at karaoke: if the crowd isn't digging me you do your thing my friend who can throw up on cue: no worries,1,2.155651,1,0.056425508
11,9012,"Be us straight, queer, muscular, fat, tall, short, twink, bear, large, small, piercing, hairy, slim, domineering, submissive, HIV Poz or Negative, we are all brothers. Let's not discriminate among ourselves, we already suffer discrimination.",0,0.5108929,0,0.49672472
12,9013,I've learned how to turn self-doubt into an energy source and to metabolize fear into a result-producing adrenaline. Wednesday Wisdom,0,0.9247082,0,0.0
13,9014,These Disney covers are making me very nostalgic. What's your favorite Disney song? American Idol,0,0.8689319,0,0.0
14,9015,Iyanna’s CashApp has been disabled. We will update this thread when we have more information.,0,0.908757,0,0.0
15,9016,they never mention this but you can only become a veterinarian once you can untangle two geese,1,2.327457,1,0.428607
16,9017,My girlfriend told me that my dick is two inches bigger than her ex's. And that is why she will never go back into a lesbian relationship.,1,2.2718322,1,2.2341886
17,9018,"Yes, that was my husband skipping on national television. He's a bit competitive. Still A Kid At Heart Beat An Eighth Grader",1,1.9574281,0,0.0
18,9019,"If a child has an episode of AOM prior to 12 mos of age, they have a 70% chance of another AOM episode sometime in their life. AAP 19 tweet iatric ian",0,0.6430749,0,0.0
19,9020,Almost time East Coast. Gather around - 20 minutes until 2020! Rockin Eve,0,0.83723485,0,0.0
20,9021,"Just 5 days until we launch the new black kids swim website! The questions, requests, participation, and continued support from black swimmers and black swim parents have pushed us to become a more dynamic organization.",0,0.66959906,0,0.31133318
21,9022,"Up next, who stays and who goes home? I'll be back with the results American Idol",0,0.9938537,0,0.0
22,9023,The first minute in the hot tub always feels the best... after that it's hard to relax with my neighbors yelling at me to get out of their yard.,1,2.7913482,1,0.0
23,9024,Saw a homeless guy babbling about conspiracy theories that doesn't really make sense... You could say it was a vague rant.,1,2.9432578,1,0.9216887
24,9025,"Almost 20 years later, we still carry the scars of xenophobia, islamaphobia, and 9/11 is used as a tool to keep people out of our country instead of a memorial. May we grow and change this year. And may their memories be a blessing.",0,0.46278104,0,0.11796346
25,9026,Sitting her wondering are my 5 inch heels days over. All the guys look so comfortable and the women are suffering. I 'm always prepared for any occasion. I want pretty feet in the future. you girlfriend next door i m just saying,0,0.8967841,0,0.21684004
26,9027,Be HIS BEST FRIEND.. real talk,0,0.8417677,0,0.0
27,9028,I burned a kid in a wheelchair today. Hot wheels.,1,2.7799044,1,1.8232297
28,9029,"What's the difference between mass and weight? Mass is where Catholics go on Sunday, and weight is where sundaes go on Catholics. ",1,2.4928856,0,2.2739868
29,9030,My condolences for you and your family through this difficult transition is why my wife won't let me send back wedding RSVP cards.,1,2.5155706,0,0.0
30,9031,You'd be surprised how much you can learn from people who disagree with you.,0,0.70803654,0,0.0
31,9032,"You know... When someone says to you ""Jesus loves you."" It's always comforting. Unless you are in a Mexican jail.",1,2.2304199,0,3.2114503
32,9033,If Whites were the 'positive' in 1950s. Then blacks must been 'niggative',1,1.7533505,0,3.6723115
33,9034,The US flag on the moon lost its color and is now completely white It's now the French flag.,1,2.9823065,1,0.08311027
34,9035,Scratch and win tickets that look like scabs where you have to pick them off to see if you won.,1,2.447244,0,0.0
35,9036,What's the difference between a blonde and an Airbus A380? Not everyone has been in an Airbus A380.,1,1.9936892,0,2.7437587
36,9037,Having sex with a waitress sucks. She only takes the tip.,1,2.5441759,1,1.3338745
37,9038,"The difference between husbands and wives: When my wife says 'I need to talk to you about something', there is a 99% chance it's not good. When I say 'I need to talk to you about something', there is an 99% chance it will be followed by a fart.",1,2.4371095,1,0.78118944
38,9039,Out of respect for all of you who have children and are forced to homeschool I've started drinking heavily this morning…,1,2.6844108,1,0.19134529
39,9040,What's another name for a boxy plow pulling baby maker? A Mexican. ,1,2.248084,0,2.1023042
40,9041,"Respect your partner, hold on tight to your man if indeed he shows how much he loves you. Real gay love is so hard, 'haaarrrrd' to find. Just be lucky you found one.",0,0.51049376,0,0.012326129
41,9042,"I am so ready for my workplace drug test today. I stayed up all night studying all the street drugs. Ask me anything! I know all about meth, marijuana, special k... I even did some coke just to try it out and help me stay awake.",1,2.3281608,0,0.43903872
42,9043,"3yo: I'm thirsty Husband: I'll get you water 3yo: no. I want her to get it for me *points to me* Me, asleep:",1,2.8657887,0,0.0
43,9044,"To the contestants who didn't make it through to the next round, your journey isn't over. It's just getting started! Take the judges' notes and make us all proud. Can't wait to see where it takes you! Hollywood Week American Idol",0,0.9589981,0,0.0
44,9045,"Coworker: Can you believe it's the end of November already? Me, unsurprised by the passage of time: Yes",1,2.735706,1,0.0
45,9046,"Do NOT compare your boyfriend to your ex. He doesn't want to be like your ex, Nor does he want to be compared to your ex",0,0.6546527,0,0.0
46,9047,"If alcohol influences short-term memory, what does alcohol do?",0,1.0477005,0,0.10993792
47,9048,Nothing meant for you can be stopped by anyone but you!! There is greater in you...You simply have to believe....Doubt is the death of dreams. -Monica Brown,0,0.22480121,0,0.0
48,9049,"I wonder if I'm the most famous person from my high school. Morrow High School, Ellenwood, GA. Class of 2004",1,2.4699392,0,0.0
49,9050,What's a blind mans worst fear ? A prius,1,2.4293923,0,1.6630011
50,9051,I made it halfway to Mexico before I realized that those sirens were just coming from the song on my radio.,1,2.534064,0,0.028304873
51,9052,Switching gears... Now inside the Dolby Theatre to usher in the final moments before the big show. On ABC - tune in! Oscars,0,0.31688678,0,0.0
52,9053,What did the momma hawk say to her chicks? Quit falcon around or get the flock outta here!,1,2.155117,0,0.0
53,9054,[family watching as the paramedics work on me] why aren't you getting him back? *me dunking on 8 foot rims in heaven*,1,2.544441,1,0.0
54,9055,"hey, brands. you don't need to do a 9/11 post. it’s ok. take the day off. we will pick back up with the pillsbury doughboy tomorrow. whether chester cheeto is for or against terrorism is not in question.",0,1.1467525,0,0.3718316
55,9056,"It's so hard to dress my 3yo that I've given up. She can wear pajamas all day. She can dress herself if she wants, and wear underwear on her head with pants as a shirt. I really don't care anymore. You do you girl.",1,2.7578819,1,0.0
56,9057,In light of all the recent blond jokes... Why are blond jokes so short? So men can remember them.,1,2.2458158,0,2.6756794
57,9058,What do they call Peter Pan in China? Peter Wok,1,2.2474842,1,1.4421479
58,9059,"if you love something, let it go. if it comes back, it might be a boomerang. bro..? are you in love with a boomerang",0,0.78366345,0,0.0
59,9060,Mia: Remember when I went thru that dumb phase? Me: No. When was that? Mia: The other day. It was like 2 whole minutes! She Keeps Me Young 😂,1,2.2361286,0,0.0
60,9061,"yeah, I believe in PREMARITAL SEX P - parentheses R E - exponents M - multiplication A R I D - division A - addition L S - subtraction E X",1,2.6782436,0,0.46329796
61,9062,I realized wrestling was fake when the undertaker who's known as 'the dead man' had to wear a knee brace,1,2.8689752,1,0.0
62,9063,"Scientists say dolphins may even be smarter than human beings, but that's funny because I don't remember ever getting my head caught in the plastic rings a six pack comes in.",1,2.7736006,1,0.029731357
63,9064,"Imagine putting all this work and effort into your kids to make sure they become decent people, and they grow up to not be funny.",1,2.786994,1,0.0
64,9065,My Muslim girlfriend wants to blow me Should I be excited or call the cops?,1,1.6105472,0,3.5426302
65,9066,"I miss the kidsI can't wait to see the spark in their eyes when they see the nature, the animals.' Mai, Green Horizons Volunteer Powered By JNF Love Grows In Israel Green Horizons",0,0.5196575,0,0.0
66,9067,My heart sinks as I think about children being unable to bathe and sleeping on the floor. It shakes me to my core. This is not a political post. I don’t care about your voting record or what side of the line you live on. What’s important to me is treating all human beings humanely.,0,0.6772995,0,0.0
67,9068,"It's called the 'guest bedroom', but a more appropriate name would be 'the room I sleep in when my wife is sick of my snoring'",1,2.9544895,0,0.051171854
68,9069,"[Community outreach] can generate community, empathy, and compassionwe work to spread this rather than fear and stress.' Ayelet Shmuel, Head of Clinical Centers for Resilience in Sderot Powered By JNF Love Grows In Israel",0,0.4372747,0,0.0
69,9070,What do you call three cars overtaking you in Mexico? Tres-passers.,1,2.6808567,1,0.340276
70,9071,Homeschooling is going great I only cried in the bathroom twice today.,1,2.230212,0,0.0
71,9072,"Man.. saddened by the news of the passing of Bill Withers. My condolences to his family and loved ones. I wake up almost every morning and listen to 'Lovely Day'. Bill's music will continue to make the world a better place and live on forever. Rest easy, legend. â¤ï",0,0.34826368,0,0.0
72,9073,"""Blessed are the peacemakers, for they will be called children of God."" Matthew 5:9 Praying For Charlotte",0,0.5983956,0,0.0
73,9074,Edward Carmack's statue was sitting in the state Capitol until it was torn down last week in the protests. The state of Tennessee has vowed to replace it.,0,0.44635355,0,0.051697582
74,9075,"As we consider medical conditions and complications, it is important to consider the role mental health plays in identification & treatment.",0,0.5204623,0,0.0
75,9076,I just found out my father's sister doesn't like Jewish people. Its hard to believe I have a relative who is auntie semitic.,1,2.1774108,0,2.8300993
76,9077,"My wife was out of town, so I had to run the morning routine by myself today. I learned a lot. For example, apparently I have two kids.",1,3.1276896,1,0.1192071
77,9078,The craziest thing you can do as an adult is fall asleep on the couch. You know you're gonna wake up at 3am with an aching back AND you still gotta shamefully walk to your bed.,1,2.6653976,0,0.0
78,9079,What do you call a gay dentist? The Tooth Fairy,1,2.0298579,1,2.0853007
79,9080,"Normally when I take my kids to the playground I'm the alpha male there, but today there were a few nine year olds who were pretty intimidating.",1,3.020026,0,0.0
80,9081,Follow your heart but don't forget your brain,0,0.5995128,0,0.0
81,9082,"Hey guys having a tech glitch - will be back up on Strava shortly. You may need to refollow me, sorry!",0,0.7201087,0,0.0
82,9083,"What does a tornado and a redneck divorce have in common? In the end, someone is going to lose a trailer.",1,2.4207792,1,1.35227
83,9084,"Any organization lacking true diversity is unable to empathize with those who experience racism, and ill equipped to respond with sincerity and effective action. Thankfully, Blackswimmers have always had a support group.",0,0.5765446,0,0.42286083
84,9085,"There were further modifications but the extant policy has still been a problem; in preparation for a meeting with the person responsible for overseeing policy, I gathered some readings on how dress codes are classist, sexist, and racist, explicitly and/or in practice, as enforced.",0,0.78836197,0,0.1778128
85,9086,3yo's are like unfiltered drunk people that love gummy fruit snacks.,1,2.7967467,0,0.52634364
86,9087,"A REAL MAN chooses to honor, love, respect, adore and be faithful to one woman.",0,0.6046608,0,0.0
87,9088,"Black Trans people's right to self determinate is vital to the survival of Black Trans people and to the health of the Black community at large. In addition to food, we have provided funds for name changes, surgeries, + clothes that help Black Trans folx live on their own terms.",0,0.28607395,0,0.38861847
88,9089,me: there were two controllers firefighter holding my xbox: im not going back in,1,2.6979375,1,0.0
89,9090,Tag us or reply below if you have resources or updates that need to be shared. Black Out Tuesday,0,0.4248724,0,0.1733919
90,9091,"The richest man is not the one who owns the most, but the one who needs the least",0,0.42926416,0,0.18696417
91,9092,Two dyslexics walk into a bra,1,2.5559301,1,0.0129806325
92,9093,"A blind man walks into a fish store ... and says: ""Whats up girls"".",1,2.410924,1,1.7410544
93,9094,"Different types of hugs He keeps you at his chest. Well, this kind of hug suggests you the fact that he loves you very much..",0,0.79408205,0,0.0
94,9095,helped us along our way. We are grateful for you! INSTEAD OF FOCUSING ON THOSE THAT FAIL TO VALUE OUR POTENTIAL BLACK KIDS SWIM CHOOSES TO REMAIN GRATEFUL AND RECOGNIZE THE CHAMPIONS WHO PRIORITIZE BLACK SWIMMERS. **,0,0.13940065,0,0.092460446
95,9096,What do black people with Down's Syndrome call their friends? Their Chromies,1,1.7635294,0,3.8007357
96,9097,"Thomas Dolby: She blinded me with science. Neil deGrasse Tyson: That's technically true. But if we're being specific, it was pepper spray.",1,2.3171716,1,0.16207406
97,9098,"Solitary confinement is supposed to be the worst psychological punishment for prison inmates, but I can confirm being locked up with small kids is worse.",1,2.37346,1,0.3764928
98,9099,me: i want this thing brain: it's expensive and you will just get bored of it in two weeks me: but it will make me happy now brain: yes but don't you want to be happy in the long term and not just for a few days me: i already bought it brain: son of a -,1,2.0083354,0,0.0
99,9100,"A study has shown that AfrAms believe that depression and other mental disorders are a sign of personal weakness. No, it's not. Stomp Stigma",0,0.6161728,0,0.36223507
100,9101,The awkward moment you're watching porn and your girlfriend walks in. I wish she'd told me she worked in the industry.,1,3.0228763,0,0.72879255
101,9102,Roses are red Sunflowers are yellow HPV vaxx prevents cancer Whether you're a gal or a fellow Vax Facts February Health Policy Valentines Vaccines Save Lives,1,1.9601096,0,0.5199427
102,9103,parents: we just want you to be yourself me: *gets a tattoo* parents: you have disgraced the family,1,2.1317544,0,0.0
103,9104,"A Jewish girl.. ..asks her father, ""Dad? Can I have 50 dollars?"" he says, ""40 dollars? What do you need 30 dollars for?""",1,1.964697,1,2.8924747
104,9105,"The nice thing about aging is that when you're over 40, you don't need to impress everyone anymore, and for the most part you don't.",1,2.5605655,0,0.0
105,9106,"this ass don’t quit, but the rest of me has given up almost immediately",0,1.5022124,0,0.4871365
106,9107,Someone asked me what my most attractive quality is and I just said lasagna,1,2.607088,0,0.0
107,9108,Give a man a jacket He'll be warm for the winter. Teach a man to jacket he won't leave the house.,1,2.4043105,0,0.0
108,9109,playing the drums on the steering wheel but slowing down because you know a tricky part is coming up,1,2.5519824,1,0.0
109,9110,Did you hear about the basketball tournament in Mexico? Its Juan vs. Juan,1,2.700803,0,0.6792523
110,9111,Comedians and politicians are basically the same They both lie to please an audience haha,1,2.787116,1,0.101169065
111,9112,What did the hillbilly say to his sister after she asked him to have sex with her? If you incest.,1,2.141765,1,1.73433
112,9113,"If I ever visit Japan, the first thing I'll do is run through those paper walls pretending I'm the Kool-Aid man.",1,2.3128688,1,0.77121717
113,9114,waitress: are you sure you want an ambulance to come? me: there's no way these are mild,1,2.3083389,1,0.16926737
114,9115,A reminder to start looking for that post-it with the WiFi password before family comes over for Thanksgiving next week,1,2.5168128,0,0.0
115,9116,Thanks for letting us share our Robertson heritage experience with you. I'm actually part German. Next maybe Oktoberfest? Wishful Thinking,0,0.660588,0,0.0
116,9117,"Wow, August is flying by! Agree or disagree?",0,0.21956052,0,0.0
117,9118,"What do I mean by seemingly neutral rules that discriminate in practice? A rule that prohibits everyone from wearing short skirts is not explicitly about women but it will disproportionately affect them. Similarly, banning locs will disproportionately impact Black people.",1,1.6382006,0,0.9728923
118,9119,"With the way I see Asian people driving, it got me thinking...Pearl Harbor might have been an accident.",1,1.8817918,0,3.198936
119,9120,That was a fun shower! But we know marriage is hard work. Please join our family in praying for JohnLuke and MaryKate's commitment. Forever,0,0.7542052,0,0.0
120,9121,[writing my own obituary after taking out a full page ad] ...and that concludes grade 6. Now here are the people I didn't like from grade 7,1,2.216938,0,0.0
121,9122,imagine your card gets declined at red lobster and all the lobsters in the tank up front start laughing at you,1,2.406857,0,0.26559567
122,9123,1 final performance then we take it from 5 to 3. Coming up next! American Idol,0,1.0166593,0,0.0
123,9124,*follows dreams *dreams get creeped out and call the police,1,2.3336496,1,0.0
124,9125,*declares himself safe after 'telling wife to calm down' incident earlier this evening,1,2.0855246,0,0.0
125,9126,I'm hiding from my kids in the closet so I can peacefully eat some cookies. I can hear them all walking around like a bunch of DEA agents. I'm trying my best to destroy all the evidence before they bust me.,1,2.7672343,1,0.009371338
126,9127,You have always been a great guy and I know your next chapter of life will be amazing. Congrats again and keep crushing it!,0,0.26475757,0,0.0
127,9128,30 seconds into the show and I'm already getting emotional American Idol,0,1.1224284,0,0.0
128,9129,"During this challenging time full of uncertainty, our team is finding hope and solace through our love of reading. We invite you to join us in finding community and moments of joy by sharing what you're reading with the hashtag Books Connect Us",0,0.29555818,0,0.0
129,9130,"lol these ppl ""don't see race"" right up until you start making beloved fictional characters black, then they're 18th century anthropologists",0,0.69161534,0,1.462262
130,9131,Finding out that Neicy Nash is queer is the best thing to happen this year!!!!!!!,1,1.1273657,0,1.145664
131,9132,A good relationship is worth the wait. On that note: Good morning.,0,0.6605614,0,0.0
132,9133,What do you call a homosexual man on a wheel chair? A human being,1,1.6344427,0,3.4603362
133,9134,"Sometimes, minding your business saves you the heartbreaks.",0,1.2024873,0,0.0
134,9135,"Any Latin teachers out there? I'm trying to get a close translation approximation to ""We are all insignificant"". Is ""Omnes Nos Humilem"" close? It was my high school language but that was in the 1900s.",1,2.517745,0,0.0
135,9136,Asking for help starts with a conversation. Let's talk to one another. Listen to one another. Help each other. Black Mental Health Matters,0,0.44864607,0,0.077029034
136,9137,"In China the labels read, ""Made by someone you know.""",1,2.438973,0,0.040844765
137,9138,The Advocate began as a protest in 1967. The LGBTQ+ movement gained justice by protesting. We stand by the belief that police brutality must end and that black lives matter and we stand by the right to protest. George Floyd Tony Mc Dade Black Trans Lives Matter,0,0.57360125,0,0.36388302
138,9139,"The lady at the massage parlor asked if I wanted a happy ending, I said yes and then she proceeded to tell me the plot of Homeward Bound.",1,2.5515566,1,0.0
139,9140,"straight men will make fun of other guys for getting pedicures and literally have hobbit feet. like go back to the shire, oakley",1,2.4285355,1,1.6238211
140,9141,"85% of conversations with my mom is trying to figure out who the ""she"" in her story is.",1,2.7526906,1,0.23016886
141,9142,there should be a court but for things that aren't illegal. like if your roommate ate all the ripple out the butterscotch ripple,1,2.647462,1,0.10021728
142,9143,"The world Dallas works in and encounters publicly is racially diverse and lots of people are ""mixed race."" The books abound with food-and-beverage skin color descriptions for non-white characters. Two of Dallas's bosses are dark skinned men but all the women in her ambit are white.",0,0.4712408,0,0.26040044
143,9144,"When your kid says mom in that tone that kinda makes you want to scream WHAT, but somehow you keep your composure and use your nice mom voice instead.",1,2.0256815,0,0.0
144,9145,"In order to strengthen our relationship, my wife and I have decided we're only going to say positive things to each other. For example, today she told me I was 'really good at leaving the dishwasher full of dishes'.",1,3.0898292,1,0.10701958
145,9146,"People who go to the gym for exercise, but complain about having to park one block away and walk: explain.",1,2.6658943,1,0.0
146,9147,Did you hear about the blonde that stayed up all night to see where the sun went? It finally dawned on her.,1,2.3997076,1,1.5206898
147,9148,"Everyday, some gay guys get HIV treatment and live healthier lives. They take care of their health and manage HIV as a condition not sickness. What are you waiting for? Get tested, Get treatment. HIV isn't a death sentence. HIV isn't AIDS.",0,0.2951868,0,0.304619
148,9149,"Black men shot by police, mass sterilization in border concentration camps, billionaires rolling in the dough while millions starve, environmental protections being rolled back, racism, antisemitism, homophobia, islamaphobia, conspiracy theories...how many fronts must we fight???",0,1.0004163,0,0.874553
149,9150,Some people have trouble sleeping. I can do it with my eyes closed. haha,1,2.7533932,0,0.0
150,9151,"They shouldn't give participation ribbons to kids, they should give them to adults because when you're over 30 years old, getting up the motivation to go out and do stuff is a big deal.",1,2.0543542,0,0.15993123
151,9152,What belongs to me but is used the most by others? My ex-wife,1,2.6668386,0,0.17562105
152,9153,we got a new neighbour and I thought it was taking him weeks to move in but turns out he works for u-haul,1,2.9388514,0,0.0
153,9154,"Cell phones didn't work. We couldn't get in touch with our cousins in New York City, one of whom worked very close to the Twin Towers. Circuits were busy, so we couldn't tell our parents we were okay. All of us were shaken and traumatized.",0,0.8756962,0,0.0
154,9155,Gassy Joke What makes a Mexican gassy? Taco night. What makes a white person gassy? Chipotle. What makes a Jew gassy? Auschwitz,1,1.8409752,0,2.844067
155,9156,You wouldn't ignore signs of heart attack or broken bone. Don't ignore signs of mental illness. Take care of your brain and mind. Stop Stigma,0,0.41064173,0,0.0
156,9157,This is who I am. I'm not perfect. I don't want to try to be perfect. Monday Motivation,0,0.63594234,0,0.0
157,9158,me rolling down window of time machine: McDonald's hot dog? guy in 2027: not yet bud,1,2.875126,1,0.0
158,9159,I'm shaking what my momma gave me. It's the most darling snowglobe I've ever seen. LOOK AT IT.,1,2.821184,1,0.0
159,9160,Do people sometimes unintentionally claim others' ideas as their own b/c they've forgotten/assimilated them? Sure. That's where a scholarly community has to hold them accountable. Whose work do we allow to pass as conventional wisdom/public domain and who do we insist on crediting?,0,0.53025067,0,0.0
