,id,text,is_humor,humor_rating,humor_controversy,offense_rating
326,9327,There are 2 kinds of families on Thanksgiving. Which one are you?,0,1.6030887,0,0.017163863
327,9328,"There is just no way I can respond individually to everyone's kind messages about my mom. I really don't know what to say. The Armstrongs are a very small family. When I realize how big and beautiful my Twitter family is, it takes my breath away. ❤️❤️❤️❤️❤️",0,0.49436995,0,0.0
328,9329,"A Muslim, a black guy, a horse, a pirate, a gay, a chicken and a rabbi all walk into a bar... The bartender says, ""What is this, some kind of joke?""",1,1.8265928,0,1.7505473
329,9330,Why can't Stevie Wonder see his friends? Because he's married. didn t see that coming,1,2.8227289,0,0.7309791
330,9331,My 3yo gave me her baby this morning and I've been walking around with it around my hip for like 30 min. I don't know why.,1,3.1600945,0,0.0
331,9332,"No matter how bad things get around the world, it can never ruin the enjoyment I get from putting my cold hands on my wife's back.",1,2.27559,1,1.5278641
332,9333,2020 is pretty cool because every once in a while you get to experience every emotion at once. And it's just like ahhh omg please stop hahah,1,2.0500746,0,0.0
333,9334,And then there's my dad...🙄,0,1.4127233,0,0.014394963
334,9335,"The world is a scary place. Hug your children tight, hide under their bed, stay there until the dust settles.",0,1.2714581,0,0.0
335,9336,"every time i go to the aquarium, the employees make up sea life facts in an attempt to catch me off guard and make me look foolish. well it won’t work. “dolphins breathe air” grow up. “octopuses have beaks” fuck off liar",1,2.4613316,0,0.0062611606
336,9337,"The cashier at the grocery store was flirting with my husband, and I'm a little mad because she didn't even give him a discount.",1,2.7289758,1,0.0
337,9338,"I'm looking to interview some essential workers. I looking for a nurse, a grocery store cashier, and a ride share driver. Especially if your outgoing. tag someone who'd love to do this.",0,1.409201,0,0.0
338,9339,It is advisable that partners in meaningful gay relationships run health checks to know their STD status and fitness level. This gives them a peace of mind and clears all doubts.,0,0.46404904,0,0.15187104
339,9340,trying to come up with ideas for tshirts for cool 20 something year olds to wear and all I got so far is one that says 'Eat The Peel',1,2.197719,1,0.2345199
340,9341,"Happy Girls Travel! happy girls travel The best way to keep a smile on your face is to contstantly stretch yourself out of your comfort zone and see the world Travel opens your mind, thoughts, and perspectives. your girlfriend next door",0,0.40880242,0,0.0
341,9342,"There's three things you should know about me, I'm Canadian, I watch Hockey, and... I'm sorry.",1,3.0148194,0,0.11160377
342,9343,"When pressure and stress bear down on you, how do you cope? Who do you talk to? What resources do you take advantage of? Get a plan mn tl hlth",0,0.6420018,0,0.0
343,9344,"In a parallel universe, a zebra is walking around her contemporary decorated house, on top of a skinned blonde chick with big hoops rug.",1,2.3985422,0,1.6955318
344,9345,"My 3yo doesn't understand why I can't make lunch right now, it's 10pm. Why is she still awake? 😭",1,2.7668068,0,0.10976787
345,9346,"As my 3yo threw grapes on the floor she said, ""for the vacuum to eat."" Now I know why the vacuum is always so full... because someone has been over feeding it!",1,3.0490394,1,0.0
346,9347,How are wearing Crocs like having butt sex with a guy? It feels really good until you look down and realize you're gay.,1,2.157591,0,3.248291
347,9348,"Our goals for this 6 K 6 Days challenge are to raise $6,000+ to: - sustain and expand our International Grocery Fund - Hire an additional chef this winter - maintain our storage space - continue our Okra Outings for Black Trans folx - continue and expand our By Okra series",0,0.76418734,0,0.0
348,9349,son: why can't we just get a gun for protection me looking for our jar of bees: check your room again,1,2.3923428,1,0.0
349,9350,Why did the blonde tiptoe past the medicine cabinet? She didn't want to wake the sleeping pills.,1,2.3195496,0,1.678015
350,9351,"The reason womansplaining isn't a thing is because it's men's responsibility to figure out what women mean when they roll their eyes, sigh, or say nothing to us.",1,2.3639011,1,0.9708269
351,9352,me: I have to let the chicken rest before cutting it or the juices will go everywhere trick or treaters: we'll come back,1,2.8098154,0,0.0
352,9353,I guess I 'm what you 'll call a creative being. My journey through life has always been through the creative process. I simply love to create. your girlfriend next door,0,1.3893632,0,0.0
353,9354,I'm definitely of the 73% conservatives who are proud to be an American! A Thankful Heart Grateful For Freedom No Place Like Home Happy July 4 th,0,0.9329051,0,0.0
354,9355,"3yo: *throwing grapes on the floor* Me: what are you doing? 3yo: for the vacuum Me: I told you to stop feeling the vacuum 9yo, walks in: *starts eating the grapes off the floor* 3yo: see that's the vacuum Me:",1,2.3307047,1,0.0
355,9356,"Don't forget - you get to vote 30 times tonight! That's 10 each via text, the American Idol app, and our website. Use them all before the LAST commercial break! Idol Finale",0,0.40891016,0,0.0
356,9357,"So we have a blow up globe to go with one of Asher's curricula. We blew it up today for the first time. Noa grabs it and Asher goes ""holding it by the poles, Noa?' This kid...",1,2.7402954,0,0.0
357,9358,"I admire both my parents and have the utmost respect for their personalitiesI have deep sorrow not knowing them personally.' Yossi Ron, Retired Israeli Air Force Colonel and Chairman of the Organization for the Children of Kfar Etzion Yom Ha Zikaron Love Grows In Israel",0,0.67789733,0,0.0
358,9359,Having kids can really strengthen a marriage. My wife and I never had a common enemy before.,1,2.4159083,0,0.1794873
359,9360,My 3yo asked me if I wanted to lay down on the couch and take a nap while we watch movies. I'm really scared. Is this a dream? Are my kids burning the house down while I sleep?,1,2.8974786,0,0.0
360,9361,The price of anything is the amount of time you exchange for it.,0,1.0320275,0,0.0
361,9362,"If you could travel back in time, what time period would you go to and why? Stray Questions",0,1.13383,0,0.0
362,9363,"Don't like getting forced by your wife to go to children's birthday parties? Easy solution - bring beer. Then offer it to all the kids, report them to the police for underage drinking, and get the party shut down.",1,2.8625956,1,0.7189718
363,9364,"Our daycare provider (who cares for 10 kids): ""I love these kids! Being around them keeps me young."" Me (with 2 kids knowing I've aged at least 10-15 years since we started having children 3 years ago): ""Yeah.... same.""",1,2.7863662,0,0.0
364,9365,What do you call a woman who misses her period? Fucked,1,1.9898103,1,2.6348279
365,9366,Why is the pussy slit verticaly and not horizontaly? So it doesn't clap when running.,1,2.3296893,0,2.8891163
366,9367,"My 3yo just broke our pinky promise, so yeah 3yo's can't be trusted.",1,2.49226,0,0.0
367,9368,"Some people call me delusional, but I don't let it bother me because I have my high IQ, millions of dollars, and god like physique to make me feel better.",1,1.8753413,0,0.24713717
368,9369,"Don't forget: Before we picked cotton, we picked tobacco. It's time to make smoking history in Black History Month",0,0.8346294,0,0.9003306
369,9370,"*Jesus multiplies loaves and fishes to feed 5000 people [5 mins later] Disciples: Hey Jesus, the people are complaining that the fish sandwiches are too dry. Can you whip something up to put on them? Jesus: Say no more -How miracle whip was invented",1,2.385697,1,0.0
370,9371,What's black and white and red all over... An interracial couple getting what they deserved.,1,1.8033911,1,3.5328774
371,9372,"""Do your best to present yourself to God as one approved...not ashamed and who correctly handles the word of truth."" 2Timothy 2:15",0,0.5352087,0,0.0
372,9373,priest: how ya doin? demon: oh yanno priest: wanna get started? demon: sure priest: will you leave brent's body? demon: nope,1,2.1511385,1,0.6797471
373,9374,"We spend too much time buying things we don't need, to impress people that don't matter",0,0.7996506,0,0.0
374,9375,"I speak to you today as a representative of [the 49 orphans of Kfar Etzion].' Yossi Ron, Retired Israeli Air Force Colonel and Chairman of the Organization for the Children of Kfar Etzion Yom Ha Zikaron Powered By JNF Love Grows In Israel",0,0.6196236,0,0.0
375,9376,Why can't black people get PhD's? Because they can't get past their Masters.,1,1.6930317,0,3.7489502
376,9377,Girls are like restaurants... Just because you can't order doesn't mean you can't look at the menu.,1,2.4695296,1,1.4625989
377,9378,"When a women dates a younger man she's called a cougar, when a man dates a younger woman he is called Defendant.",1,2.3524408,0,0.49907303
378,9379,An email from my parents: FW: FW: FW: FW: FW: FW: FW: FW: FW: FW: FW: Obama's a Muslim,1,2.250091,1,1.4039141
379,9380,"The teacher asked the class if everyone got the syllabus. Jimmy raised his hand and said, ""No, I took the boring short bus to school.""",1,3.0222237,1,0.0
380,9381,Serotonin is flowing in the city today. This weather is 10/10,0,0.7354677,0,0.0
381,9382,"A man visits a prostitute The man says, ""I want to have sex with you for $200, but then I also want to hit you"" The prostitute asks, ""For how long?"" The man replies, ""Until I have my money back!""",1,2.3153071,1,2.1176631
382,9383,Cow milking is an incredibly low-skilled job. Any jerk can do it.,1,2.9847887,0,0.40371138
383,9384,"Not to brag, but I can get a full 8 hours of sleep and still look absolutely exhausted when I wake up in the morning",1,2.5671942,1,0.0
384,9385,We had a great time with kids from Blair E. Batson Hospital for Children doing arts and crafts today. Thank you Sanderson Farms Championship!,0,0.925864,0,0.0
385,9386,me: of course I consider you a friend and not just the guy who carries me during karaoke guy who carries me during karaoke: ok thank you,1,2.3020942,0,0.0
386,9387,Just voted and was informed that only 10% of registered voters have shown up today. Come on Peeps! Privilege And Responsibility Or Dont Complain,0,1.3030366,0,0.0
387,9388,If only there were mosquito nets in Africa... We could save millions of mosquitoes from dying needlessly of AIDS.,1,2.3306046,0,3.407871
388,9389,Isn't it annoying when engineering students call themselves engineers? You don't hear medical students calling themselves doctors or arts students calling themselves baristas.,1,2.7679076,0,0.0
389,9390,"Count your blessings, not your problems.",0,0.3894963,0,0.0
390,9391,"Like authors of sheikh novels, Brockmann appeals to knowledge and relationships as a means of overcoming prejudice. Yet rather than white feminism integrating Arab/Muslim/Middle Eastern heroes into neoliberal modernity, +",0,0.2189641,0,0.5134185
391,9392,boss: what are you thinking about me: [daydreaming about the end of capitalism] just spreadsheets and stuff,1,2.199454,1,0.104620345
392,9393,"My Asian friend came out .. My Asian friend came out to his dad today and said ""Dad I'm gay"" . His dad after being angry for a moment said, ""why not Gay+""",1,1.7718441,0,2.9641793
393,9394,netflix: are you still watching me: yes but i can't reach the remote so i'm just going to sit here in silent contemplation,1,2.7125993,0,0.0
394,9395,"How many men does it take to open a beer? None, the beer should be open by the time she has brought it to you. haha",1,2.430966,1,2.5550184
395,9396,How many Jews did Hitler kill? Over nein thousand. haha,1,1.7603348,1,3.507937
396,9397,This is why we can't have nice things' ~my wife looking at my paystub,1,2.7997584,1,0.27961457
397,9398,"After I saw Deadpool I thought ""This is amazing. How could they possibly pull this off again? I mean they must have exhausted all the comic book movie jokes!"" And yet, DP2 looks fucking incredible.",0,1.3292024,0,0.0
398,9399,"I was gonna get dressed up for Halloween this year, but that involves getting dressed, so no.",1,2.7910151,0,0.0
399,9400,Why did the blind man cross the road? Cuz he couldn't see it ,1,2.7386425,0,1.1905231
400,9401,What did the black Jew say to the non-believers? We Israel..,1,1.8101081,0,3.4295452
401,9402,"His love is not enough. You also need his respect, appreciation, and commitment.",0,0.20231733,0,0.0
402,9403,How dirty can white shoes get before you throw them out? Stray Questions,1,2.4028585,0,0.39684355
403,9404,"Some of you aren't going to like this, but my wife and I are that couple that sit on the same side in restaurant booths. But it's not because we're weird, it's because our imaginary friends have to sit on the other side.",1,2.6704319,1,0.0
404,9405,Comment below a story about how failing led you to succeed? Wednesday Wisdom,0,0.6540159,0,0.0
405,9406,the inside of a chicken is warm but as soon as the egg comes out the chicken is like 'ya gotta keep this in the fridge',1,2.3277388,1,0.42383403
406,9407,"Yes, plagiarism is bad and it's sometimes deliberate. Still, it's not primarily individual bad actors who are to blame for widespread citational lapses. We're not building communities that value engagement and conversation. Instead, we reward name-dropping but fetishize originality.",0,0.5820146,0,0.0
407,9408,"If a woman sleeps with 10 men she's a slut, but if a man does it‚ He's gay, definitely gay.",1,1.8607856,1,3.6150014
408,9409,We're having a great time with the kids from Wolfson children's Hospital and Community PedsCare during THE PLAYERS Championship!!,0,0.653883,0,0.0
409,9410,Happy Canada Day to my heart’s homeland! 🇨🇦,0,0.67428374,0,0.0
410,9411,"I just want a magical unicorn, and to not gain weight when I eat a lot of food. That's all.",0,1.318842,0,0.0
411,9412,How can any gay relationship be fun if there aren't DRAMA and ATTITUDE? There's nothing like a perfect relationship anywhere. We just have to learn to compromise our egos and hold on to mutual love and respect.,0,0.41375825,0,0.0070548877
412,9413,"Our ancestral trauma doesn't give us a pass, it makes us more obligated."" - Lilli Sher Best sentence I've heard all year about Jews and our commitment to social justice!!!",0,0.49613008,0,0.15166871
413,9414,"My boss thinks that homosexuality is a disease, so I'm calling in gay tomorrow.",1,2.8978646,1,1.0337607
414,9415,I would say you should not worry about that. It's your peace of heart and mine that matters not his selfishness.,0,0.9775466,0,0.0
415,9416,"Motherhood is complicated because we'll share our whole body with our kids, but not our snacks.",1,2.9818773,1,0.5948545
416,9417,"Social media is so weird. It's like here are all the cool things your friends are up to, and also all the worst things going on in the world. Enjoy trying to sort out your emotions.",1,1.8942959,0,0.0
417,9418,"'If u insinuate that I'm fat again, I'm leaving you!' 'Don't be selfish, think about the baby.' 'What baby?' 'Oh, so you're not pregnant?'",1,1.8628471,0,0.043720447
418,9419,Your current circumstance doesn't determine where you can go; it just determines where you start.,0,0.33813006,0,0.0
419,9420,Just saw a fat woman lick icing off of her sleeve so that is the last time I eat in front of a mirror.,1,2.5970047,0,1.0416082
420,9421,What do you call a fat Irish family? The o'Beses.,1,2.5221348,1,1.9927593
421,9422,"""...put on love, which binds all virtues together in perfect unity...and be thankful."" Col. 3:14-15. Have a wonderful Thanksgiving Day!",0,0.5319055,0,0.0
422,9423,I 'm missing an authentic Mexican restaurant experience. Margarita please! margaritas,0,1.5743705,0,0.0005530955
423,9424,Hey NYC! The Okra Projectnis doing another theatre outing THIS WEEKEND! We are taking 10 Black TRANS/GNC folx to see A Strange Loop at Playwrights Horizons! Hit us up if you'd like to go!,0,0.8932419,0,0.4237404
424,9425,My date and I went swimming in the ocean and her eyebrows washed off. She looked just as surprised as I did.,1,2.6454635,1,0.096894115
425,9426,"My gambling addiction ruined my marriage, but it also saved it because we're so broke we can't afford a divorce.",1,3.274984,0,0.27225822
426,9427,"Daddy, look, a ninja! Billy, don't offend those Muslims! rofl",1,1.7393583,1,3.1128578
427,9428,"Too much bickering, backbiting, gossips, betrayal, imitation and stereotype in the LGBTQ community. This is unhealthy. A community is all we have, let's preserve its sanctity!",0,0.4352114,0,0.063804924
428,9429,i'm constantly being told that i'm a straight acting gay person. what part of sticking things up my butt is straight acting to people,1,1.9882468,0,3.1196764
429,9430,We cannot direct the wind but we can adjust the sails.,0,0.8268665,0,0.0
430,9431,What I have learned in 2020. Yesterday was yesterday. I 'm allowed to give myself a clean slate. The past is the past. I will show up as who I am and from what I 've learned. I will use my gifts and be a positive inspiration to others. your girlfriend next door,0,0.45322877,0,0.0
431,9432,"detective: he’s dead, ma’am my wife: oh my god i can’t believe he drank all the windshield fluid detective: *narrowing eyes* i never said he was poisoned my wife: no that was literally just an educated guess",1,2.6223269,1,0.0
432,9433,"Building your dreams requires a vision, a budget, a skilled architect, a great contractor, a committed team, the will to win",0,0.53129613,0,0.0
433,9434,Me: Direct me home Google Maps: There’s a different route available Me: Oh cool is it shorter? Google Maps: No it’s 47 minutes longer Me: Oh Google Maps: I found one with no tolls! Me: Cool but is it- Google Maps: Clear your schedule motherfucker it’s 2 hours longer,1,2.5605192,1,0.12994567
434,9435,Don't quit on urself. Don't hurt urself. U're worth the world and nobody wants to see u suffering. This isn't the end. The way u feel right now will pass. People's minds will change. Things WILL get better. We love u and are always here for u. This too shall pass!,0,0.30950877,0,0.0
435,9436,My 3yo told me to chill out. Is she too young for me to kick her out of my house? No,1,2.3928828,0,0.0
436,9437,"Everyone you meet is fighting a battle you know nothing about, be kind, don't be ammunition",0,0.3251489,0,0.0
437,9438,If history is written by the victors... ...then who writes French history textbooks?,1,2.3863935,1,0.8850435
438,9439,[taking out foot massage coupon from marriage coupon book] I wanna redeem this one [ex wife here to pick up our son] where is he brent,1,2.61543,0,0.27702904
439,9440,I still have nightmares about the time I gave my Eskimo friend a house warming gift...,1,2.0539203,1,0.46234936
440,9441,All Snapchat has to do to attract an older audience is offer a face filter that takes away the bags from under your eyes.,1,2.5625155,0,0.21661828
441,9442,I've been hearing a lot about mass murderers lately.... It must be a scary time to be catholic.,1,2.341514,0,1.4710319
442,9443,Don't be afraid to text him first. I promise he'll like it.,0,1.725756,0,0.0
443,9444,"Why do cannibals prefer to eat blind people? Because with one sense gone they taste really good. Sorry, that was wrong... they taste really well.",1,2.3442547,1,2.255949
444,9445,teen working at subway: you're gonna get me in trouble with my manager me trying to pass him a baggie of duck meat: I'll distract richard,1,2.6838925,1,0.0
445,9446,"Your smile is your logo, your personality is your business card, how you leave others feeling after an experience becomes your trademark.",0,0.34053877,0,0.0
446,9447,I like my men like I like my coffee... Nowhere near my vagina. A little lesbian humor....I'm not gay I just couldn't resist....too good :),1,1.935623,0,2.7094913
447,9448,a haiku about 2020: fuck fuck fuck fuck fuck fuck fuck fuck fuck fuck fuck fuck fuck fuck fuck fuck fuck,1,1.5359741,0,0.62554693
448,9449,You can't eat in the shower - me lying to my kid,1,2.8682835,0,0.0
449,9450,What do you call 40 mexicans standing in your yard holding hands? Spicket fence.,1,2.1532826,0,2.9084651
450,9451,Having a 3yo is like having your personal narrator that sometimes makes you cry because they won't stop narrating.,1,2.6625757,1,0.20199594
451,9452,"Make sure you compliment her on what she's insecure about most, it's easy, but it means a lot&lt;3 boyfriend tips",0,0.5540693,0,0.0
452,9453,Stop buying new parents junk gifts they're not going to use. Buy them bag reducing eye cream.,1,2.615501,1,0.42025927
453,9454,"My Facebook timeline says I joined in 2007, a couple decades before that I was born, and there are no accomplishments in between. How did they know?",1,3.0323954,0,0.0
454,9455,"I love when my mom works the rapture into casual conversation. We were talking about work and she casually goes ""if I ever disappear it's because I've been raptured. You will need to immediately come to my house and read my bible to be saved"" and I'm like ""ok love you too bye""",1,2.4299784,1,0.67667377
455,9456,"I've been feeling a bit down lately. My husband finally came clean tonight... He's been contacting my friends to call me, get me out of the house, etc. I have the best husband...and my friends are good liars.",1,2.4051144,0,0.0
456,9457,Italians and Spaniards are so used to Catholic child abuse... ... That they call the Pope daddy,1,2.1518154,0,2.58865
457,9458,"Gun violence kills 13,000 blacks a year. Tobacco kills 47,000 blacks a year. We have to end both. spread truth making smoking history",0,0.34434602,0,0.041359477
458,9459,2 hours to midnight! Who's partying with us? Send pics Rockin Eve,0,0.51570517,0,0.0
459,9460,Whats the difference between Jelly and Jam? I can't jelly my dick into your girls ass.,1,2.2623808,0,2.9532847
460,9461,"Although it is a problem which has risen a lot of opinions, it seems that men prefer that kind of women who don't make the first move.",0,1.5948037,0,0.0
461,9462,People who post tweets with spelling mistakes in them are total loosers,1,1.797639,0,0.10368535
462,9463,Heart disease is a condition which disproportionately affects African-Americans.,0,0.6098086,0,0.08734758
463,9464,"You can consider yourself lucky in life, if the cognac you drink is older than the woman that you're sleeping with.",1,2.3520875,1,0.91612554
464,9465,me: can I get lettuce instead of the bun? guy working at subway: why you doin this man?,1,2.5168266,1,0.0
465,9466,The used car salesmen always get so weirded out when we go for a test drive and I put on a ski mask and make a quick stop at the bank.,1,3.0608525,1,0.0
466,9467,"What do you call a hypocritical member of the church of Latter Day Saints? an oxy-mormon. or, all of them.",1,2.5404425,1,1.0978719
467,9468,Today is National Teacher Day! Shout-ouÂ­Â­Â­t to all the teachers who continue to educate and inspire during these difficult times. Thank you for going above and beyond to guide the minds of our future!,0,0.48112273,0,0.0
468,9469,"Yet in a world clearly taken from this one, where other sorts of changes are explored at length, simply omitting racism from the pictureâ apart from isolated opinions expressed by a couple of retrograde bigotsâ doesn't signal a utopia so much as a failed attempt at color-blindness.",1,1.9204682,0,0.8700017
469,9470,"""School was good"" is teenager for ""I only fell asleep during one Zoom class today.""",1,2.7890527,0,0.0
470,9471,"If I got 50 cents for every failed math exam, I'd have $ 6.30 now",1,2.7841947,1,0.0
471,9472,Up next - the audition that shocked the judges...in the best way possible. American Idol,0,1.2313032,0,0.0
472,9473,"Happens to eminent senior white scholars - imagine how much more often to junior scholars, especially Black women and women of color.",0,0.9242858,0,1.2473711
473,9474,"The organizations, forums, events, and companies that love Black swimmers and work tirelessly to ensure they succeed. This Black Swim Community has always had your back â and we 're not going anywhere.",0,0.34233448,0,0.33166277
474,9475,Who was your first celebrity crush? Stray Questions,0,1.4401724,0,0.03863673
475,9476,"Tonight, Disney Family Singalong Vol. 2 is dedicated to all the amazing moms out there. Sit back, relax, and enjoy the show!",0,1.3104895,0,0.041504964
476,9477,billionaire who invited me to his island: *loading rifle* i have a passion for.. the most dangerous game me: *nodding* Gun Monopoly billionaire: what? no i’m hunting you. me: oh ok billionaire: you should probably go me: not without my $200,1,2.556092,1,0.06867207
477,9478,"Shoutout to the parents, family, and friends who drop everything to show their support at auditions. You bring so much love to every city we go American Idol",0,0.6487826,0,0.0
478,9479,You'll be surprised to know how far you can go from the point where you thought it was the end.,0,0.5799246,0,0.0
479,9480,When you see your friends win and you proud of them ... you a good friend,0,1.1484728,0,0.0
480,9481,Sending my love and condolences to his family. I am forever grateful to have known him. RIP,0,0.34184253,0,0.0
481,9482,Me blacking out when I'm drunk is God's way of telling me that what I do when I drink is none of my business.,1,2.7834148,0,0.46979544
482,9483,"An app like tinder, but instead of for dating, it matches you up with strangers in your area to have arguments with.",1,2.312369,0,0.0
483,9484,"Do non-male scholars plagiarize/unethically use others' work? I've seen it, usually with women's work, rarely if ever men. Do male scholars plagiarize/unethically use other men's work? I've been told so, but again, very rarely, and usually early career.",1,1.8590873,0,1.0121005
